Symbol,Name,Last Sale,Net Change,% Change,Market Cap,Country,IPO Year,Volume,Sector,Industry
PSA^O,Public Storage Depositary Shares Each Representing 1/1000 of a 3.900% Cumulative Preferred Share of Beneficial Interest Series O,$25.46,-0.0699,-0.274%,,United States,,22613,,
PSB,PS Business Parks Inc. (MD) Common Stock,$155.19,0.25,0.161%,4272226596.00,United States,,135882,Consumer Services,Real Estate Investment Trusts
PSB^W,PS Business Parks Inc. Depositary Shares Each Representing 1/1000 of a Share of 5.20% Cumulative Preferred Stock Series W,$25.70,-0.06,-0.233%,,United States,,4777,,
PSB^X,PS Business Parks Inc. Depositary Shares Each Representing 1/1000 of a Share of 5.25% Cumulative Preferred Stock Series X,$26.75,-0.05,-0.187%,,United States,,4211,,
PSB^Y,PS Business Parks Inc. 5.20% Cumulative Preferred Stock Series Y,$26.50,-0.07,-0.263%,,United States,,3732,,
PSB^Z,PS Business Parks Inc. Depositary Shares Each Representing 1/1000 of a Share of 4.875% Cumulative Preferred Stock Series Z  par value $0.01 per share,$26.91,-0.05,-0.185%,,United States,,17135,,
PSF,Cohen & Steers Select Preferred and Income Fund Inc. Common Stock,$29.71,0.27,0.917%,357012829.00,,2010,14046,,
PSFE,Paysafe Limited Common Shares,$11.32,-0.22,-1.906%,8192424164.00,,2021,4155684,Miscellaneous,Business Services
PSN,Parsons Corporation Common Stock,$40.03,-0.25,-0.621%,4099416578.00,,2019,407467,Capital Goods,Industrial Machinery/Components
PSO,Pearson Plc Common Stock,$11.86,-0.09,-0.753%,8968939628.00,United Kingdom,,411548,Consumer Services,Books
PSTG,Pure Storage Inc. Class A Common Stock,$19.09,-0.11,-0.573%,5408004516.00,,2015,8438518,Technology,Electronic Components
PSTH,Pershing Square Tontine Holdings Ltd. Class A Common Stock,$24.64,0.10,0.407%,4928002464.00,,2020,1655063,,
PSTL,Postal Realty Trust Inc. Class A Common Stock,$20.14,-0.09,-0.445%,269288355.00,,2019,69191,Consumer Services,Real Estate Investment Trusts
PSX,Phillips 66 Common Stock,$84.41,1.04,1.247%,36960358028.00,United States,,2903506,Energy,Integrated oil Companies
PSXP,Phillips 66 Partners LP Common Units representing limited partner interest in the Partnership,$40.63,-0.30,-0.733%,9277460132.00,United States,2013,600141,Energy,Oil & Gas Production
PTA,Cohen & Steers Tax-Advantaged Preferred Securities and Income Fund Common Shares of Beneficial Interest,$24.99,-0.01,-0.04%,1381283690.00,,2020,175572,,
PTR,PetroChina Company Limited Common Stock,$40.81,0.13,0.32%,74690861040.00,China,,136683,Energy,Oil & Gas Production
PTY,Pimco Corporate & Income Opportunity Fund,$19.78,0.10,0.508%,2187998544.00,United States,2002,393959,,
PUK,Prudential Public Limited Company Common Stock,$42.87,0.43,1.013%,56065572184.00,United Kingdom,,492791,Finance,Life Insurance
PUK^,Prudential Public Limited Company 6.75% Perpetual Subordinated Captial Security,$27.33,0.00,0.00%,,United Kingdom,,6684,,
PUK^A,Prudential Public Limited Company 6.50% Perpetual Subordinated Capital Securities Exchangeable at the Issuer's Option Into Non-Cumulative Dollar Denominated Preference Shares,$27.12,0.11,0.407%,,United Kingdom,,5105,,
PUMP,ProPetro Holding Corp. Common Stock,$9.98,0.28,2.887%,1020757703.00,United States,2017,587506,Energy,Oilfield Services/Equipment
PV,Primavera Capital Acquisition Corporation Class A Ordinary Shares,$9.65,-0.02,-0.207%,518687500.00,,2021,218549,Finance,Business Services
PVG,Pretium Resources Inc. Ordinary Shares (Canada),$11.33,-0.10,-0.875%,2128148842.00,Canada,,523480,,
PVH,PVH Corp. Common Stock,$116.63,2.26,1.976%,8311748682.00,United States,,550904,,
PVL,Permianville Royalty Trust Trust Units ,$1.65,-0.012,-0.722%,54450000.00,United States,2011,30156,Energy,Oil & Gas Production
PWR,Quanta Services Inc. Common Stock,$95.58,1.28,1.357%,13318699473.00,United States,,1134917,Capital Goods,Engineering & Construction
PXD,Pioneer Natural Resources Company Common Stock,$151.94,1.65,1.098%,37066127808.00,United States,,3064821,Energy,Oil & Gas Production
PYN,PIMCO New York Municipal Income Fund III Common Shares of Beneficial Interest,$10.71,-0.04,-0.372%,61346880.00,United States,2002,4108,,
PYS,Merrill Lynch Depositor Inc PPlus Tr Ser RRD-1 Tr Ctf Cl A,$21.6177,-0.1873,-0.859%,0.00,United States,,1367,Finance,Trusts Except Educational Religious and Charitable
PZC,PIMCO California Municipal Income Fund III Common Shares of Beneficial Interest,$11.15,-0.12,-1.065%,249548150.00,United States,2002,59462,,
PZN,Pzena Investment Management Inc Class A Common Stock,$11.14,-0.05,-0.447%,808402162.00,United States,2007,29685,Finance,Investment Managers
QD,Qudian Inc. American Depositary Shares each representing one Class A Ordinary Share,$2.14,0.04,1.905%,541608744.00,China,2017,2068475,Technology,Computer Software: Prepackaged Software
QFTA,Quantum FinTech Acquisition Corporation Common Stock,$9.66,-0.05,-0.515%,243009375.00,,2021,11336,,
QGEN,Qiagen N.V. Common Shares ,$49.14,-0.17,-0.345%,11223919980.00,Netherlands,,622193,Health Care,Biotechnology: Biological Products (No Diagnostic Substances)
QS,QuantumScape Corporation Class A Common Stock,$26.25,-0.67,-2.489%,10656816004.00,United States,2020,14599569,Capital Goods,Auto Parts:O.E.M.
QSR,Restaurant Brands International Inc. Common Shares,$69.37,0.86,1.255%,21026966777.00,Canada,2014,1128930,,
QTS,QTS Realty Trust Inc. Class A Common Stock,$62.69,-0.42,-0.666%,4319463246.00,United States,2013,508968,Consumer Services,Real Estate Investment Trusts
QTS^A,QTS Realty Trust Inc. 7.125% Series A Cumulative Redeemable Perpetual Preferred Stock,$27.10,0.02,0.074%,,United States,,5825,,
QTS^B,QTS Realty Trust Inc. 6.50% Series B Cumulative Convertible Perpetual Preferred Stock,$142.65,-0.36,-0.252%,,United States,,315,,
QTWO,Q2 Holdings Inc. Common Stock,$95.90,-0.80,-0.827%,5399679229.00,,2014,318205,Technology,EDP Services
QUAD,Quad Graphics Inc Class A Common Stock,$3.34,0.09,2.769%,182632556.00,United States,,268750,Consumer Services,Recreational Products/Toys
QUOT,Quotient Technology Inc. Common Stock,$11.06,-0.17,-1.514%,1032588476.00,,2014,526747,Technology,Advertising
QVCC,QVC Inc. 6.250% Senior Secured Notes due 2068,$26.05,-0.06,-0.23%,0.00,United States,2019,22845,,
QVCD,QVC Inc. 6.375% Senior Secured Notes due 2067,$25.99,0.03,0.116%,0.00,United States,2018,15949,,
R,Ryder System Inc. Common Stock,$82.61,0.83,1.015%,4450232670.00,United States,,716385,Miscellaneous,Rental/Leasing Companies
RA,Brookfield Real Assets Income Fund Inc. Common Stock,$21.55,-0.23,-1.056%,945892060.00,,2016,420263,,
RAAS,Cloopen Group Holding Limited American Depositary Shares each representing two Class A Ordinary Shares,$9.51,-0.95,-9.082%,1563160355.00,,2021,1202034,Technology,Computer Software: Prepackaged Software
RACE,Ferrari N.V. Common Shares,$210.00,-2.52,-1.186%,52082460570.00,,2015,310352,Capital Goods,Auto Manufacturing
RAD,Rite Aid Corporation Common Stock,$18.19,0.56,3.176%,1002337067.00,United States,,1988110,Health Care,Medical/Nursing Services
RAMP,LiveRamp Holdings Inc. Common Stock,$49.66,1.20,2.476%,3323217950.00,United States,2018,745216,Technology,EDP Services
RBA,Ritchie Bros. Auctioneers Incorporated Common Stock,$60.23,-0.68,-1.116%,6642201201.00,Canada,,476589,,
RBAC,RedBall Acquisition Corp. Class A Ordinary Shares,$9.86,-0.01,-0.101%,708687500.00,United States,2020,140798,Finance,Business Services
RBC,Regal Beloit Corporation Common Stock,$141.29,1.46,1.044%,5740600690.00,United States,,276633,Consumer Durables,Metal Fabrications
RBLX,Roblox Corporation Class A Common Stock,$97.47,7.76,8.65%,55541472699.00,,2021,19802921,Technology,EDP Services
RC,Ready Capital Corproation Common Stock,$15.05,0.19,1.279%,1071886570.00,United States,2013,531640,Consumer Services,Real Estate Investment Trusts
RC^B,Ready Capital Corporation 8.625% Series B Cumulative Preferred Stock,$25.465,-0.0112,-0.044%,,United States,,2148,,
RC^C,Ready Capital Corporation 6.25% Series C Cumulative Convertible Preferred Stock,$25.00,0.00,0.00%,,United States,,322,,
RC^D,Ready Capital Corporation 7.625% Series D Cumulative Redeemable Preferred Stock,$25.28,0.01,0.04%,,United States,,12763,,
RCA,Ready Capital Corporation 7.00% Convertible Senior Notes due 2023,$26.24,0.12,0.459%,0.00,United States,2017,10089,,
RCB,Ready Capital Corporation 6.20% Senior Notes due 2026,$26.35,-0.01,-0.038%,0.00,United States,2019,191,,
RCC,Ready Capital Corporation 5.75% Senior Notes due 2026,$25.60,-0.03,-0.117%,,United States,2021,40350,Finance,Finance Companies
RCI,Rogers Communication Inc. Common Stock,$51.35,0.05,0.097%,25927915079.00,Canada,,230221,,
RCL,D/B/A Royal Caribbean Cruises Ltd. Common Stock,$94.76,2.27,2.454%,24123115457.00,United States,1993,5389081,,
RCS,PIMCO Strategic Income Fund Inc.,$7.72,0.10,1.312%,345137685.00,United States,1994,84102,,
RCUS,Arcus Biosciences Inc. Common Stock,$24.89,0.39,1.592%,1767086955.00,,2018,851559,Health Care,Major Pharmaceuticals
RDN,Radian Group Inc. Common Stock,$23.34,0.09,0.387%,4465328440.00,United States,,1044822,Finance,Property-Casualty Insurers
RDS/B,Royal Dutch Shell PLC,$36.61,-0.44,-1.188%,,Netherlands,,3731949,,
RDY,Dr. Reddy's Laboratories Ltd Common Stock,$72.22,0.25,0.347%,12010274903.00,India,,127013,Health Care,Major Pharmaceuticals
RE,Everest Re Group Ltd. Common Stock,$259.93,5.23,2.053%,10418910653.00,Bermuda,,1750009,Finance,Property-Casualty Insurers
RELX,RELX PLC PLC American Depositary Shares (Each representing One Ordinary Share),$26.24,-0.30,-1.13%,50726345297.00,United Kingdom,2015,716620,Consumer Services,Publishing
RENN,Renren Inc. American Depositary Shares each representing fifteen Class A ordinary shares,$12.15,0.55,4.741%,286495080.00,China,2011,182669,Technology,EDP Services
RES,RPC Inc. Common Stock,$4.99,0.07,1.423%,1076517770.00,United States,,527424,Energy,Oilfield Services/Equipment
REV,Revlon Inc. New Common Stock,$12.61,0.41,3.361%,674463151.00,United States,1996,270938,Consumer Non-Durables,Package Goods/Cosmetics
REVG,REV Group Inc. Common Stock,$19.27,1.10,6.054%,1247504459.00,United States,2017,254713,Capital Goods,Industrial Machinery/Components
REX,REX American Resources Corporation,$96.82,2.82,3.00%,580145634.00,United States,,37583,Basic Industries,Automotive Aftermarket
REXR,Rexford Industrial Realty Inc. Common Stock,$54.71,-0.52,-0.942%,7334551114.00,United States,2013,1783226,Consumer Services,Real Estate Investment Trusts
REXR^A,Rexford Industrial Realty Inc. 5.875% Series A Cumulative Redeemable Preferred Stock,$25.42,0.031,0.122%,,United States,,349,,
REXR^B,Rexford Industrial Realty Inc. 5.875% Series B Cumulative Redeemable Preferred Stock,$26.4229,0.0129,0.049%,,United States,,1835,,
REXR^C,Rexford Industrial Realty Inc. 5.625% Series C Cumulative Redeemable Preferred Stock par value $0.01 per share,$27.60,0.00,0.00%,,United States,,85,,
REZI,Resideo Technologies Inc. Common Stock ,$30.46,1.36,4.674%,4381682971.00,,2018,735458,Miscellaneous,Diversified Manufacture
RF,Regions Financial Corporation Common Stock,$23.37,0.54,2.365%,22465239705.00,United States,,8693831,Finance,Major Banks
RF^A,Regions Financial Corporation Depositary Shares Representing 1/40th Perpetual Preferred Series A,$25.3868,0.0168,0.066%,,United States,,46647,,
RF^B,Regions Financial Corporation Depositary Shares Representing 1/40th Perpetual Preferred Series B,$29.04,-0.11,-0.377%,,United States,,15141,,
RF^C,Regions Financial Corporation Depositary Shares each Representing a 1/40th Interest in a  Share of 5.700% Fixed-to-Floating Rate Non-Cumulative  Perpetual Preferred Stock Series C,$28.15,0.04,0.142%,,United States,,11773,,
RF^E,Regions Financial Corporation Depositary Shares Each Representing a 1/40th Interest in a Share of 4.45% Non-Cumulative Perpetual Preferred Stock Series E,$25.00,-0.01,-0.04%,,United States,,354250,,
RFI,Cohen & Steers Total Return Realty Fund Inc. Common Stock,$15.39,-0.14,-0.901%,403996719.00,United States,1993,61407,,
RFL,Rafael Holdings Inc. Class B Common Stock,$49.64,4.31,9.508%,827580011.00,United States,2018,47305,Health Care,Major Pharmaceuticals
RFM,RiverNorth Flexible Municipal Income Fund Inc. Common Stock,$24.12,0.17,0.71%,147486540.00,,2020,4593,,
RFMZ,RiverNorth Flexible Municipal Income Fund II Inc. Common Stock,$20.25,-0.10,-0.491%,0.00,,2021,34205,,
RFP,Resolute Forest Products Inc. Common Stock,$17.28,1.10,6.799%,1366694502.00,Canada,,1994706,Basic Industries,Paper
RGA,Reinsurance Group of America Incorporated Common Stock,$126.31,2.98,2.416%,8587216043.00,United States,,608386,Finance,Life Insurance
RGR,Sturm Ruger & Company Inc. Common Stock,$77.99,1.10,1.431%,1371344964.00,United States,,215495,,
RGS,Regis Corporation Common Stock,$9.24,-0.10,-1.071%,330697937.00,United States,1991,320110,,
RGT,Royce Global Value Trust Inc. Common Stock,$15.01,0.13,0.874%,84067873.00,,2013,3770,,
RH,RH Common Stock,$644.01,5.41,0.847%,13522160116.00,United States,2012,344698,Consumer Services,Other Specialty Stores
RHI,Robert Half International Inc. Common Stock,$88.94,1.26,1.437%,10030705852.00,United States,,1227164,Technology,Diversified Commercial Services
RHP,Ryman Hospitality Properties Inc. (REIT),$75.58,-0.16,-0.211%,4160704168.00,United States,,233645,Consumer Services,Real Estate Investment Trusts
RICE,Rice Acquisition Corp. Class A Common Stock,$15.80,0.05,0.317%,468609830.00,United States,2020,54613,,
RIG,Transocean Ltd (Switzerland) Common Stock,$3.87,0.10,2.653%,2388946956.00,Switzerland,,12832931,Energy,Oil & Gas Production
RIO,Rio Tinto Plc Common Stock,$87.74,2.94,3.467%,142048066136.00,Australia,2002,2905990,Basic Industries,Steel/Iron Ore
RIV,RiverNorth Opportunities Fund Inc. Common Stock,$17.99,0.10,0.559%,182726229.00,,2015,81848,Finance,Finance Companies
RJF,Raymond James Financial Inc. Common Stock,$131.79,-1.27,-0.954%,18110332190.00,United States,,2054451,Finance,Investment Bankers/Brokers/Service
RKT,Rocket Companies Inc. Class A Common Stock,$18.35,0.89,5.097%,2504297386.00,United States,2020,24700373,Finance,Finance: Consumer Services
RKTA,Rocket Internet Growth Opportunities Corp. Class A Ordinary Shares,$9.78,0.00,0.00%,326407500.00,,2021,297,,
RL,Ralph Lauren Corporation Common Stock,$125.64,1.60,1.29%,9188218040.00,United States,1997,1364246,Consumer Non-Durables,Apparel
RLGY,Realogy Holdings Corp. Common Stock,$17.49,-1.94,-9.985%,2036261497.00,United States,2012,6418702,Finance,Real Estate
RLI,RLI Corp. Common Stock (DE),$105.15,0.79,0.757%,4753141506.00,United States,,109247,Finance,Property-Casualty Insurers
RLJ,RLJ Lodging Trust Common Shares of Beneficial Interest $0.01 par value,$15.43,0.08,0.521%,2544680883.00,United States,2011,1732950,Consumer Services,Real Estate Investment Trusts
RLJ^A,RLJ Lodging Trust $1.95 Series A Cumulative Convertible  Preferred Shares,$27.80,0.05,0.18%,,United States,,18668,,
RLX,RLX Technology Inc. American Depositary Shares each representing the right to receive one (1) Class A ordinary share,$11.73,0.85,7.813%,18425373386.00,,2021,8435902,Consumer Non-Durables,Farming/Seeds/Milling
RM,Regional Management Corp. Common Stock,$46.90,0.51,1.099%,498401422.00,United States,2012,94944,Finance,Finance: Consumer Services
RMAX,RE/MAX Holdings Inc. Class A Common Stock,$34.70,-0.30,-0.857%,1091322009.00,,2013,107957,Finance,Real Estate
RMD,ResMed Inc. Common Stock,$205.96,0.35,0.17%,29970852679.00,United States,,1152882,Health Care,Medical/Dental Instruments
RMI,RiverNorth Opportunistic Municipal Income Fund Inc. Common Stock,$22.69,0.08,0.354%,144609451.00,,2018,7777,,
RMM,RiverNorth Managed Duration Municipal Income Fund Inc. Common Stock,$20.08,-0.06,-0.298%,396369501.00,,2019,98003,,
RMO,Romeo Power Inc. Class A Common Stock,$8.38,0.31,3.841%,1099433793.00,,2019,3897555,Capital Goods,Automotive Aftermarket
RMPL^,RiverNorth Specialty Finance Corporation 5.875% ,$25.45,0.05,0.197%,,,,602,,
RMT,Royce Micro-Cap Trust Inc. Common Stock,$12.19,0.08,0.661%,533492766.00,United States,,159688,,
RNG,RingCentral Inc. Class A Common Stock,$258.39,-2.32,-0.89%,23480677054.00,,2013,1321131,Technology,EDP Services
RNGR,Ranger Energy Services Inc. Class A Common Stock,$7.90,0.40,5.333%,134078579.00,United States,2017,3120,Energy,Oilfield Services/Equipment
RNP,Cohen & Steers REIT and Preferred and Income Fund Inc. Common Shares,$26.00,-0.21,-0.801%,1237137018.00,United States,2003,89901,,
RNR,RenaissanceRe Holdings Ltd. Common Stock,$154.15,0.61,0.397%,7651653921.00,Bermuda,,2875247,Finance,Property-Casualty Insurers
RNR^E,RenaissanceRe Holdings Ltd. 5.375% Series E Preference Shares,$25.26,-0.10,-0.394%,,Bermuda,,26799,,
RNR^F,RenaissanceRe Holdings Ltd. Depositary Shares each Representing a 1/1000th Interest in a 5.750% Series F Preference Share,$26.73,-0.30,-1.11%,,Bermuda,,11508,,
ROG,Rogers Corporation Common Stock,$188.41,0.08,0.042%,3525556935.00,United States,,75031,Capital Goods,Industrial Machinery/Components
ROK,Rockwell Automation Inc. Common Stock,$263.09,2.58,0.99%,30538617688.00,United States,,1717349,Capital Goods,Industrial Machinery/Components
ROL,Rollins Inc. Common Stock,$33.86,0.00,0.00%,16663302252.00,United States,,2225759,Technology,Industrial Specialties
ROP,Roper Technologies Inc. Common Stock,$447.49,3.06,0.689%,47093412640.00,United States,1992,443723,Capital Goods,Office Equipment/Supplies/Services
ROSS,Ross Acquisition Corp II Class A Ordinary Shares,$9.75,0.02,0.206%,420468750.00,,2021,1207,,
ROT,Rotor Acquisition Corp. Class A Common Stock,$9.90,0.00,0.00%,341550000.00,,2021,651031,,
RPAI,Retail Properties of America Inc. Class A Common Stock,$11.97,0.08,0.673%,2570348719.00,United States,2012,1058350,Consumer Services,Real Estate Investment Trusts
RPM,RPM International Inc. Common Stock,$93.74,0.52,0.558%,12140392449.00,United States,,534539,Basic Industries,Paints/Coatings
RPT,RPT Realty Common Stock,$12.67,-0.03,-0.236%,1028360968.00,United States,,268745,Consumer Services,Real Estate Investment Trusts
RPT^D,RPT Realty 7.25% ,$57.1383,0.1583,0.278%,,United States,,814,,
RQI,Cohen & Steers Quality Income Realty Fund Inc Common Shares,$15.28,-0.06,-0.391%,2051236539.00,United States,2002,310383,,
RRC,Range Resources Corporation Common Stock,$13.50,-0.21,-1.532%,3369476219.00,United States,,3793376,Energy,Oil & Gas Production
RRD,R.R. Donnelley & Sons Company Common Stock,$6.35,-0.02,-0.314%,458470000.00,United States,,1232777,Consumer Services,Advertising
RS,Reliance Steel & Aluminum Co. Common Stock (DE),$168.31,1.86,1.117%,10722666887.00,United States,1994,425687,Basic Industries,Steel/Iron Ore
RSF,RiverNorth Specialty Finance Corporation,$18.8955,-0.0044,-0.023%,97644367.00,,2019,45559,,
RSG,Republic Services Inc. Common Stock,$109.00,1.04,0.963%,34774641799.00,United States,1998,2564426,Public Utilities,Environmental Services
RSI,Rush Street Interactive Inc. Class A Common Stock,$12.57,0.19,1.535%,2754833205.00,,2020,2474238,Consumer Services,Services-Misc. Amusement & Recreation
RTP,Reinvent Technology Partners Class A Ordinary Shares,$9.95,0.03,0.302%,858187500.00,United States,2020,468201,Finance,Business Services
RTPZ,Reinvent Technology Partners Z Class A Ordinary Shares,$10.00,0.00,0.00%,287500000.00,United States,2021,38068,Finance,Business Services
RTX,Raytheon Technologies Corporation Common Stock,$88.61,2.11,2.439%,134252113381.00,United States,,10490026,Capital Goods,Military/Government/Technical
RVI,Retail Value Inc. Common Stock ,$17.39,-0.14,-0.799%,366637752.00,United States,2018,1120137,Consumer Services,Real Estate Investment Trusts
RVLV,Revolve Group Inc. Class A Common Stock,$56.06,2.16,4.007%,4047891176.00,,2019,953954,Consumer Services,Catalog/Specialty Distribution
RVT,Royce Value Trust Inc. Common Stock,$19.08,0.16,0.846%,1945639059.00,United States,1986,160327,,
RWT,Redwood Trust Inc. Common Stock,$11.07,-0.04,-0.36%,1251026202.00,United States,1995,684889,Consumer Services,Real Estate Investment Trusts
RXN,Rexnord Corporation Common Stock,$49.92,-0.13,-0.26%,5976475315.00,United States,2012,673534,Technology,Industrial Machinery/Components
RY,Royal Bank Of Canada Common Stock,$104.52,1.83,1.782%,148925666498.00,Canada,,1164323,,
RY^T,Royal Bank Of Canada 6.750% Fixed Rate/Floating Rate Noncumulative First Preferred Shares Series C-2,$28.471,-0.429,-1.484%,,Canada,,1155,,
RYAM,Rayonier Advanced Materials Inc. Common Stock,$7.99,0.46,6.109%,508142850.00,United States,2014,436082,Basic Industries,Industrial Specialties
RYB,RYB Education Inc. American depositary shares each representing one Class A ordinary share,$4.18,0.10,2.451%,115310926.00,,2017,169007,Miscellaneous,Other Consumer Services
RYI,Ryerson Holding Corporation Common Stock,$16.44,0.66,4.183%,632522325.00,United States,2014,125526,Capital Goods,Office Equipment/Supplies/Services
RYN,Rayonier Inc. REIT Common Stock,$38.23,0.17,0.447%,5315114644.00,United States,,625664,Consumer Services,Real Estate Investment Trusts
RZA,Reinsurance Group of America Incorporated 6.20% Fixed-to-Floating Rate Subordinated Debentures due 2042,$26.45,0.04,0.151%,0.00,United States,,32784,Finance,Life Insurance
RZB,Reinsurance Group of America Incorporated 5.75% Fixed-To-Floating Rate Subordinated Debentures due 2056,$27.94,-0.06,-0.214%,0.00,United States,2016,22112,,
SA,Seabridge Gold Inc. Ordinary Shares (Canada),$19.45,0.87,4.682%,1467293763.00,Canada,,561797,,
SAF,Saratoga Investment Corp 6.25% Notes due 2023,$25.371,-0.0577,-0.227%,0.00,United States,2018,1127,Finance,Finance Companies
SAFE,Safehold Inc. Common Stock,$70.44,0.01,0.014%,3751833041.00,United States,2017,317074,Consumer Services,Real Estate Investment Trusts
SAH,Sonic Automotive Inc. Common Stock,$48.92,0.23,0.472%,2034816540.00,United States,1997,119715,Consumer Services,Other Specialty Stores
SAIC,SCIENCE APPLICATIONS INTERNATIONAL CORPORATION Common Stock,$88.95,-0.21,-0.236%,5156235454.00,,,798213,Technology,EDP Services
SAIL,SailPoint Technologies Holdings Inc. Common Stock,$47.60,0.67,1.428%,4377329796.00,United States,2017,832085,Technology,Computer Software: Prepackaged Software
SAK,Saratoga Investment Corp 7.25% Notes due 2025,$26.47,0.0011,0.004%,0.00,United States,2020,232,Finance,Finance Companies
SAM,Boston Beer Company Inc. (The) Common Stock,$1030.45,-75.49,-6.826%,12660907299.00,United States,,834384,Consumer Non-Durables,Beverages (Production/Distribution)
SAN,Banco Santander S.A. Sponsored ADR (Spain),$4.22,0.13,3.178%,73058862758.00,Spain,,5404578,Finance,Commercial Banks
SAND          ,Sandstorm Gold Ltd. Ordinary Shares (Canada),$8.46,0.04,0.475%,1646061777.00,Canada,,1154389,,
SAP,SAP  SE ADS,$138.35,-3.20,-2.261%,163194801689.00,Germany,,713748,Technology,EDP Services
SAR,Saratoga Investment Corp New,$25.48,0.63,2.535%,284356673.00,United States,,61377,,
SAVE,Spirit Airlines Inc. Common Stock,$36.02,0.33,0.925%,3904586118.00,United States,,2188476,Transportation,Air Freight/Delivery Services
SB,Safe Bulkers Inc Common Stock ($0.001 par value),$3.70,-0.15,-3.896%,395030818.00,Monaco,2008,2926828,Transportation,Marine Transportation
SB^C,Safe Bulkers Inc Cumulative Redeemable Perpetual Preferred Series C (Marshall Islands),$25.10,0.05,0.20%,,Monaco,,2316,,
SB^D,Safe Bulkers Inc Perpetual Preferred Series D (Marshall Islands),$25.18,0.07,0.279%,,Monaco,,1533,,
SBBA,Scorpio Tankers Inc. 7.00% Senior Notes due 2025,$25.22,0.07,0.278%,0.00,Monaco,2020,9653,Transportation,Marine Transportation
SBG,Sandbridge Acquisition Corporation Class A Common Stock,$9.93,-0.05,-0.501%,285487500.00,,2020,139639,,
SBH,Sally Beauty Holdings Inc. (Name to be changed from Sally Holdings Inc.) Common Stock,$21.73,0.11,0.509%,2454489746.00,United States,,820518,Miscellaneous,Diversified Commercial Services
SBI,Western Asset Intermediate Muni Fund Inc Common Stock,$9.57,0.0291,0.305%,134767755.00,United States,1992,13866,,
SBII,Sandbridge X2 Corp. Class A Common Stock,$9.79,0.00,0.00%,291469211.00,,2021,9242,,
SBOW,SilverBow Resorces Inc. Common Stock,$17.04,1.38,8.812%,207828326.00,,,393410,Energy,Oil & Gas Production
SBR,Sabine Royalty Trust Common Stock,$35.75,0.14,0.393%,521211584.00,United States,,31587,Energy,Oil & Gas Production
SBS,Companhia de saneamento Basico Do Estado De Sao Paulo - Sabesp American Depositary Shares (Each repstg 250 Common Shares),$7.96,0.04,0.505%,5440738557.00,Brazil,2002,987565,,
SBSW,D/B/A Sibanye-Stillwater Limited ADS,$18.22,0.73,4.174%,13449025677.00,,,2392751,Basic Industries,Precious Metals
SC,Santander Consumer USA Holdings Inc. Common Stock,$37.91,0.53,1.418%,11601814714.00,,2014,861587,Finance,Finance Companies
SCCO,Southern Copper Corporation Common Stock,$69.19,1.94,2.885%,53488939482.00,United States,,1891127,Basic Industries,Precious Metals
SCD,LMP Capital and Income Fund Inc. Common Stock,$13.90,-0.07,-0.501%,249664892.00,United States,2004,28642,,
SCE^G,SCE Trust II Trust Preferred Securities,$24.95,-0.06,-0.24%,,United States,,8939,,
SCE^H,SCE Trust III Fixed/Floating Rate Trust Preference Securities,$25.15,0.03,0.119%,,United States,,78805,,
SCE^J,Southern California Edison Company 5.375% Fixed-to-Floating Rate Trust Preference Securities,$25.05,0.00,0.00%,,United States,,71566,,
SCE^K,Southern California Edison Company 5.45% Fixed-to-Floating Rate Trust Preference Securities,$25.47,0.03,0.118%,,United States,,12265,,
SCE^L,SCE TRUST VI,$24.74,-0.0364,-0.147%,,United States,,18639,,
SCHW,Charles Schwab Corporation (The) Common Stock,$73.85,2.32,3.243%,139306676766.00,United States,,14693797,Finance,Investment Bankers/Brokers/Service
SCHW^C,The Charles Schwab Corporation Depositary Shares each representing 1/40th interest in a share of 6% Non-Cumulative Perpetual Preferred Stock Series C,$24.99,0.00,0.00%,,United States,,21886,,
SCHW^D,The Charles Schwab Corporation Depositary Shares each representing 1/40th interest in a share of 5.95% Non-Cumulative Perpetual Preferred Stock Series D,$25.28,0.00,0.00%,,United States,,30737,,
